{
  "schema_version": "1.0.0",
  "content_id": "FL-TEST-C",
  "site_id": null,
  "mode": "dry_run",
  "state": "preview_blocked",
  "payload_ready": false,
  "network_ready": false,
  "publication_allowed": false,
  "human_approval_required_before_publish": true,
  "proposed_payload": {
    "status": "draft",
    "title": "転職を考える人の90日ワーク――条件、試行、見直しを一冊に残す",
    "content": "<p>仕事を変えたい理由は書けたけれど、その後の準備がつながらない。このワークでは、条件を記入し、調べた情報と試した結果を残し、次に何を確かめるかを決めていきます。最後に作るのは、応募した件数の一覧ではなく、自分の条件と未確認事項を添えた判断メモです。</p>\n\n<p>無料の整理記事は、変えたいこと、残したいこと、次に確かめることを見つけるために使えます。ここではその先を、条件シート、試行メモ、比較表として繰り返し使える形にします。自分で事情を書き込むワークであり、個別鑑定、適職の判定、転職の成功を約束するサービスではありません。90日は作業を整理するために置いた期間で、効果が実証された日数や退職の期限ではありません。</p>\n\n<h2>最初に、守りたい条件と計画の上限を決める</h2>\n\n<p>始める前に、今の生活でこの準備に使える時間を確認します。毎晩取り組む予定が合わなければ、休日の一度だけでも構いません。作業時間だけでなく、今は進めないことも書いてください。「今月は応募せず、条件を調べるところまで」と決めるなら、それが今回の計画の範囲です。</p>\n\n<p>次のシートは、説明用の架空の記入例です。実際の相談者や成功例を紹介するものではありません。自分の欄を埋めるときは、完成した言い方に整えるより、気になっている場面を残すことを優先してください。</p>\n\n<table><thead><tr><th>条件シート</th><th>架空の記入例</th><th>自分の記入欄</th></tr></thead><tbody>\n<tr><td>変えたい場面</td><td>夕方に翌朝締切の依頼が来る</td><td>いつ、何に困るかを書く</td></tr>\n<tr><td>残したい仕事</td><td>情報を集めて資料にする仕事</td><td>続けたい作業を書く</td></tr>\n<tr><td>今回使える時間</td><td>休日に一度、短く取り組む</td><td>実際の予定に合わせる</td></tr>\n<tr><td>今はしないこと</td><td>条件を確認する前に退職を決める</td><td>自分の判断の境界を書く</td></tr>\n</tbody></table>\n\n<p>「残したい仕事」が書けなければ、無理に長所へ言い換えなくて構いません。「次もやってよい仕事」として一つ挙げる方法もあります。空欄は不足の印ではなく、これから確かめる問いとして扱います。</p>\n\n<h2>1〜30日：経験を、確かめられる問いにする</h2>\n\n<p>最初の期間は、一つの仕事を取り上げて、依頼されたこと、自分が進めた部分、次も続けたい部分を記録します。たとえば架空の記入例では、「資料を作った」から一段具体的にして、「複数の説明資料から必要な情報を拾い、読む順番を並べ直した」と置けます。仕事の名前だけで比較しないための作業です。</p>\n\n<p>続けたい部分が見えたら、働き方への希望とは別の行に書きます。「情報を整理する作業」と「依頼の予定が早めに分かること」は、候補を見る際にそれぞれ確かめる項目です。片方が合いそうだからといって、もう片方も合うと埋めないでください。</p>\n\n<p>ここまで書けたら、募集内容を一件選んで読み、条件の横に「記載あり」「未記載」「確認が必要」を残します。情報を読むだけで分かる範囲と、問い合わせ等が必要な範囲が分かれたところで一度区切ります。候補が見つからなければ、自分の経験の記録をもう一つ増やすところに戻れます。</p>\n\n<p>この期間の終わりに見直すのは、予定した作業量よりも、問いが具体的になったかです。「自分に合う会社を探す」から「依頼の締切は誰と調整できるのかを確かめる」に変わっていれば、その問いを次の期間へ持っていきます。まだ言葉にならない部分は、判断を保留する理由として残しましょう。</p>\n\n<h2>31〜60日：一つ試して、結果の読み方を決める</h2>\n\n<p>次は、残った問いの中から一つを選び、情報を増やす行動を決めます。職務経歴の一項目を書く、募集の説明会を調べる、現職で相談できる範囲を整理するなど、今の条件で実行できるものにしてください。面談や応募そのものを必須にはしません。</p>\n\n<p>試す前に「今回何が分かればよいか」を書くのが、このワークの記録上のルールです。仮に、自分が担当した作業を説明できるか確かめたいなら、文章を一項目作り、担当範囲が読み取れるかを見直すところまでを一回の作業にします。結果を見てから目的を増やすと比較しにくいため、追加で気になった点は次回の問いに分けます。</p>\n\n<table><thead><tr><th>試行メモ</th><th>架空の記入例</th></tr></thead><tbody>\n<tr><td>確かめる問い</td><td>自分が担当した部分を説明できるか</td></tr>\n<tr><td>今回したこと</td><td>資料を整理した作業を一項目にまとめた</td></tr>\n<tr><td>確認できたこと</td><td>調べた情報と並べ方を書き分けられた</td></tr>\n<tr><td>まだ分からないこと</td><td>担当していない作業との境界が伝わるか</td></tr>\n<tr><td>次に変える部分</td><td>最初に自分の担当範囲を一文加える</td></tr>\n</tbody></table>\n\n<p>文章を見てもらう場合は、相手と確認できる範囲を選び、公開できない業務情報や他人の個人情報を持ち出さないようにします。見てもらう機会がなければ、自分で読み返して未確認のまま残して構いません。他人に確認していない内容を「評価された」と書き替えないでください。</p>\n\n<p>取り組めなかった週には、遅れを埋める作業を増やす前に、時間がなかったのか、作業の意味が曖昧だったのかを一行残します。再開時にはその一行と前回の問いを読み、同じ作業を続けるか、範囲を小さくするかを選べます。中断しても使える記録を作ることが、継続ワークの用途の一つです。</p>\n\n<h2>61〜90日：比較表から次の期間を選ぶ</h2>\n\n<p>最後の期間では、最初の条件シートと、その後に確かめた情報を並べます。新しい候補を増やすだけでなく、現職で調整を考える案も比較に置けます。まだ候補がない場合は、「何が分かれば比較できるか」を書く表として使ってください。</p>\n\n<table><thead><tr><th>確かめる条件</th><th>現職で調整する案</th><th>別の仕事を探す案</th></tr></thead><tbody>\n<tr><td>続けたい作業を担えるか</td><td>確認した内容と確認日</td><td>募集内容と確認日</td></tr>\n<tr><td>依頼の予定を相談できるか</td><td>相談できる範囲、または未確認</td><td>記載内容、または未確認</td></tr>\n<tr><td>次に必要な情報</td><td>誰に何を確かめるか</td><td>どの情報を探すか</td></tr>\n</tbody></table>\n\n<p>表に空欄が残ったら、ほかの欄のよさで埋めず、「未確認」と書きます。たとえば仕事内容に関心が持てても、予定の調整方法が分からなければ、その条件の判断は保留です。この表では合計点を作らず、守りたい条件と未確認の点を見落とさないために比較します。</p>\n\n<p>終わりの判断メモには、「今選ぶこと」「その根拠」「残っている問い」「次に見直すきっかけ」を書いてください。応募を検討する、現職で相談を続ける、もう一度条件を整理するという結論を置けます。90日目が来たことだけを、転職や退職の理由にする必要はありません。</p>\n\n<p>使い始める際は、条件シートの一行だけ記入して、次に開く日を決めてみてください。基本の条件整理に戻りたいときは、関連する無料記事「転職したいのに動けないとき、最初に確かめる三つのこと」も使えます。記録を増やすことより、自分が次に何を確かめるのか分かる状態を、その都度作り直していきましょう。</p>",
    "excerpt": "条件シート、試行メモ、比較表を使い、仕事選びの準備を90日という編集上の区切りで記録する自己記入ワーク。",
    "slug": "career-90-day-workbook",
    "categories": null,
    "tags": null,
    "featured_media": null,
    "meta": {}
  },
  "request_payload": null,
  "media_upload_plan": [
    {
      "dedup_key": "5bdecb9e073cee743d17400112cbfb598ffbb7585556ac55bfdff12b462b1ee9",
      "content_id": "FL-TEST-C",
      "asset_ids": [
        "FL-TEST-C-featured-asset-01"
      ],
      "image_sha256": "c9ef8c812329b3731e85ec174fdc92bdcc62464e8487904b8c1f2c181c1e6e23",
      "relative_path": "images/featured-v1.png",
      "mime_type": "image/png",
      "metadata": {
        "title": "FL-TEST-C-featured",
        "alt_text": "白紙のワークブックと付箋付きの三枚の用紙、鉛筆を並べたAI生成イメージ",
        "caption": "AI生成のイメージ画像です。実在する場所や体験の写真ではありません。"
      },
      "action": "upload",
      "attachment_id": null,
      "response_reference": null,
      "association": {
        "post": null,
        "state": "after_draft_creation"
      }
    }
  ],
  "inline_media": [],
  "editorial_metadata": {
    "content_id": "FL-TEST-C",
    "access_type": "PREMIUM",
    "seo_policy_version": "seo-policy-0.1.0-draft",
    "article_version": "article-1.0.0",
    "visual_style_version": "visual-style-0.1.0",
    "draft_sha256": "d0a261c9e017b572f1d43b6cb7f8e068a45fcb7d8ab8353243843b8d5e4349e0",
    "image_plan_sha256": "c07da945dd7f7e18fd651fa81d234b48e996c7452f0dc1ebb2cfacbe7061d4e0",
    "fact_check_status": "passed",
    "qa_status": "passed",
    "internal_links": [
      {
        "target_content_id": "FL-TEST-A",
        "target_url": null,
        "anchor_text": "転職したいのに動けないとき、最初に確かめる三つのこと",
        "rationale": "基本整理と継続ワークを必要に応じて行き来する",
        "direction": "outbound_from_this_page",
        "status": "candidate"
      }
    ],
    "cta": {
      "type": "related_content",
      "destination": null,
      "placement": "本文で回答した後の末尾",
      "copy_direction": "任意の次の行動。未確認のサービスや公開URLを実在と断定しない。",
      "status": "candidate"
    }
  },
  "seo_metadata": {
    "primary_keyword": "転職 準備 行動計画",
    "secondary_keywords": [],
    "search_intent": "informational",
    "meta_description": "条件シート、試行メモ、比較表を使い、仕事選びの準備を90日という編集上の区切りで記録する自己記入ワーク。",
    "canonical_url": null,
    "keyword_status": "offline_candidate_not_measured"
  },
  "qa_reference": "3007e95b065a0bff67e3f4a2b6ccd19832ea628c379879812ed4c1073d9cb9a7",
  "blockers": [
    "media_upload_required:FL-TEST-C-featured"
  ],
  "source_article_sha256": "d0a261c9e017b572f1d43b6cb7f8e068a45fcb7d8ab8353243843b8d5e4349e0",
  "rendered_content_sha256": "84b275398a7292cd1d64ccbe4af304da53e5019c0820252d7be4311bef8f9943",
  "connection_status": "not_connected",
  "wordpress_post_id": null,
  "package_sha256": "096215d3fe9ff7ae887a02fbee766d9c8a86c251186a789f1268c335138f2ddd"
}
